{"$schema":"../../../recording.schema.json","version":1,"id":"live-20261015t113459-flow-sum-anthropic-2","task":"flow-sum","scene":"flow-empty","corpus":"live","prompt":"Suggest an improvement to this graph as a Flow patch: two number inputs, 7 and 5, summed by a math node.","route":{"kind":"anthropic","model":"claude-sonnet-5-5"},"provenance":{"kind":"live","recordedAt":"2026-10-15","note":"Unreviewed live run 20261015t113459, repeat 2.","receipt":{"task":"flow-sum","route":"anthropic","model":"claude-sonnet-5-5","status":200,"outcome":"completed","startedAt":1792064223186,"durationMs":4334,"settings":{"temperature":null,"maxOutputTokens":4096,"timeoutMs":120000},"finishReason":"end_turn","usageReported":true,"inputTokens":13058,"outputTokens":576}},"response":{"status":200,"events":[{"type":"message_start","message":{"model":"claude-sonnet-5-5","id":"msg_011Cg3xMvXCuWrmq4VTrcMDR","type":"message","role":"assistant","content":[],"container":null,"stop_reason":null,"stop_sequence":null,"stop_details":null,"usage":{"input_tokens":13058,"cache_creation_input_tokens":0,"cache_read_input_tokens":0,"cache_creation":{"ephemeral_5m_input_tokens":0,"ephemeral_1h_input_tokens":0},"output_tokens":3,"service_tier":"standard","inference_geo":"global"},"diagnostics":null}},{"type":"content_block_start","index":0,"content_block":{"type":"thinking","thinking":"","signature":""}},{"type":"ping"},{"type":"content_block_delta","index":0,"delta":{"type":"thinking_delta","thinking":""}},{"type":"content_block_delta","index":0,"delta":{"type":"signature_delta","signature":"CAQSgwsKEAgSGAI4AUIIdGhpbmtpbmcSDDuxuc7IeQ9qSZwMDxoMD0R7IKRGXulYnFs/IjArUukhokYNglxRMZ6vTtprfsKyW6BxsipvR0n+Wwp11ds8/i6yUu3CjjSzcs2VLT4qoAp9oTicF0MIRhHXYPtnMHZk7owSlbTQUTE7Ov8CTNnCcYTMDdvw3vQORV91P1y4Jv0qT4zEGbwHE/WBzEJaFNQRgFvTEoEj4xKSHjacpJR8t3MR1sF0gtq9CL3Qq85ksZcaRUhA8ozJMhQPwK76uSLwOn+3tVJcN5HTR8GfDvQcRFM6Ewp+PbG7weNejfToSyg9u1wMnvlHTqXYVCYLt5xw4rLLNZPEvb+JVD9w86vrsDw09Txfxa4IEySTXDgGA6XVxGowGm2/mG0ab+xyAUrjz5PC52fr5uwi+1LbmT9F3xQsFOrvumGXww0MtaCstk5itnHiaMttwJbGdgHneZIiY4WcRKZwTxxkotNK/SNXRZPKwD1onByw1kHJ8gIC64AZqkhV8cTmZzrsiMvr74fdvDMpWXasA0eUUTwzesfAH2NQdtr02YFelt0w3nB82h/tSJKWsic+m3jwPKKeSTtZy+WFrlKKgwiUORiYgLhPgiFoeyE5zefXFLyZByl1ndrSCDc1r90Wz7srsn5iwdGHgsYj3ajfmLPoCmL4MwfdpckZdW0sBWvOcPEWvNPe1DvjeKzUFA75GMvxBHPI7lk03YSkyT80QXh3M6rEHjeWbwj5uKgie4k6a70g69QswknULeBzn6nPs7MdATL7wtRsE7c3wOThhAY1NCqUjdpGmU/G3WDHyLp8iJubFpTmkHTXHwy8ddQ/yn+zQCUO0rSA4X0BGD53wSyKb2msjzBg28Wv5rE16JCSukJFUcdd2EQtdo8b/FdcFFnfPPlR5TxZT8sw8q9cehLmOYqCSEz3vqsz3YDCUEypGt8+dwbHMyLUjT79YJ4thgJdezEryBF855qywbXfIw+PvTg1RnS+7SxwD5JqASMrglma3J3PTQ6IrE/kjusSURpXe2p7Kq3225eWYGDzoV0Wo6CceLY+iRZYD1gRHo9+H8gw7tV6k2vC5kG/zOlVNvy5n8452yOjKGXddZyPI1VDJeh3gKIaM+NjlWTlA4Ft84SV/YSdm9mfnV4wZq6p4n9JnoF1mn9S/YpRmuABLiWbOJd9XRxbHWIulp2FyIQu1dxBoymvxgV6rlHmTXDc/IAazwWGk3pTey6xTvN2GpxYGQjqbx1WLzCQEkF3mhl763S2Jkz65eTySIMS2ODVo5c9U3K05auenNgxpHSLlv/U/QphR2R0Dg80DTg7VxTUWrTVV4+7dON4YV/GTIkgSbkonYeMHc7s7uEVlHxYYcucASWE0vWiZp1g70llNaNLlVv997aKEBs+ykVD+LwSbwY6YKbz/Zain57zmlnN81XartWaYcmM/hq4Zo2fbinNO1Se4xvp/MFKKU7hsiEAtuNX0dFm5YYJgu0a1bXk3IJQgmiYZhODfUreHqW/eAzFoAVkWJqJiXbvJQATHBZ/45Tl+NdUbiAOFHyar2T1qQBzXgsy6ZwY5AxH5MmQWTc6/kHzjWN1XQK0D1WKmWFGOelWNl1X0ExIqR3SX7nYdEi0tSWR7K00oFuPSHyZ5HN5rJdXhK2UjQBkn+0KseoluJEcDYkyHYrYueAu4KGW+DClUwC2Xm2NwKklY/nxF23X5mfIycAxzpXm+OoS0+8CTRJ2IK3Zwfgkorn0GUJgiAtAHxlK9mxt5fbebpeF3QSbAgRdXJ42IVAxdsFeNOSgFkti25na4kM5diur29CaVljsT0o5zqRUT/34HqtqrHBUnWSi7EUBbT/tXqo/TCaQtz22QpCmIa2dGAE="}},{"type":"content_block_stop","index":0},{"type":"content_block_start","index":1,"content_block":{"type":"text","text":""}},{"type":"content_block_delta","index":1,"delta":{"type":"text_delta","text":"{"}},{"type":"content_block_delta","index":1,"delta":{"type":"text_delta","text":"\"version\":1,\"kind"}},{"type":"content_block_delta","index":1,"delta":{"type":"text_delta","text":"\":\"flow.patch\",\""}},{"type":"content_block_delta","index":1,"delta":{"type":"text_delta","text":"operations\":[{\"op\":"}},{"type":"content_block_delta","index":1,"delta":{"type":"text_delta","text":"\"addNode\",\"alias\":"}},{"type":"content_block_delta","index":1,"delta":{"type":"text_delta","text":"\"num_a\",\"type\":\""}},{"type":"content_block_delta","index":1,"delta":{"type":"text_delta","text":"core.number\",\"pos\":["}},{"type":"content_block_delta","index":1,"delta":{"type":"text_delta","text":"0,0]},{\"op"}},{"type":"content_block_delta","index":1,"delta":{"type":"text_delta","text":"\":\"addNode\",\"alias"}},{"type":"content_block_delta","index":1,"delta":{"type":"text_delta","text":"\":\"num_b\",\"type\":"}},{"type":"content_block_delta","index":1,"delta":{"type":"text_delta","text":"\"core.number\",\"pos\":"}},{"type":"content_block_delta","index":1,"delta":{"type":"text_delta","text":"[0,160"}},{"type":"content_block_delta","index":1,"delta":{"type":"text_delta","text":"]},{\"op\":\"add"}},{"type":"content_block_delta","index":1,"delta":{"type":"text_delta","text":"Node\",\"alias\":\"s"}},{"type":"content_block_delta","index":1,"delta":{"type":"text_delta","text":"um\",\""}},{"type":"content_block_delta","index":1,"delta":{"type":"text_delta","text":"type\":\"core.math\",\"p"}},{"type":"content_block_delta","index":1,"delta":{"type":"text_delta","text":"os\":[320"}},{"type":"content_block_delta","index":1,"delta":{"type":"text_delta","text":",80"}},{"type":"content_block_delta","index":1,"delta":{"type":"text_delta","text":"]},{\"op\":\"set"}},{"type":"content_block_delta","index":1,"delta":{"type":"text_delta","text":"Param\",\"node\":\"num_"}},{"type":"content_block_delta","index":1,"delta":{"type":"text_delta","text":"a\",\"param\":\"value\",\"value"}},{"type":"content_block_delta","index":1,"delta":{"type":"text_delta","text":"\":7},{\"op\":\""}},{"type":"content_block_delta","index":1,"delta":{"type":"text_delta","text":"setParam\",\"node\":\"num"}},{"type":"content_block_delta","index":1,"delta":{"type":"text_delta","text":"_b\",\"param\":\"value\",\""}},{"type":"content_block_delta","index":1,"delta":{"type":"text_delta","text":"value\":5},{\"op\":"}},{"type":"content_block_delta","index":1,"delta":{"type":"text_delta","text":"\"setParam\",\"node\":\""}},{"type":"content_block_delta","index":1,"delta":{"type":"text_delta","text":"sum\",\"param\":\"op\",\""}},{"type":"content_block_delta","index":1,"delta":{"type":"text_delta","text":"value\":\"add\"},{\""}},{"type":"content_block_delta","index":1,"delta":{"type":"text_delta","text":"op\":\"connect\",\"from\":"}},{"type":"content_block_delta","index":1,"delta":{"type":"text_delta","text":"[\"num_a\",\"value\"],"}},{"type":"content_block_delta","index":1,"delta":{"type":"text_delta","text":"\"to\":[\"sum\",\"a"}},{"type":"content_block_delta","index":1,"delta":{"type":"text_delta","text":"\"]},{\"op\":\""}},{"type":"content_block_delta","index":1,"delta":{"type":"text_delta","text":"connect\",\"from\":[\"num_"}},{"type":"content_block_delta","index":1,"delta":{"type":"text_delta","text":"b\",\"value\"],\"to\":"}},{"type":"content_block_delta","index":1,"delta":{"type":"text_delta","text":"[\"sum\",\"b\"]}"}},{"type":"content_block_delta","index":1,"delta":{"type":"text_delta","text":"]}"}},{"type":"content_block_stop","index":1},{"type":"message_delta","delta":{"stop_reason":"end_turn","stop_sequence":null,"stop_details":null,"container":null},"usage":{"input_tokens":13058,"cache_creation_input_tokens":0,"cache_read_input_tokens":0,"output_tokens":576,"output_tokens_details":{"thinking_tokens":319}}},{"type":"message_stop"}],"done":false},"evidence":{"source":"flow","models":[],"totalModels":0,"modelMetadataTruncated":false,"sourceAvailability":"available","reportProvenance":"unknown","totalRows":1,"includedRows":1,"sampled":false,"projectionTruncated":false,"evidence":{"summary":{"kind":"graph-only","executionStatus":"not included"},"rows":[{"citation":"E1","data":{"graph":{"id":"00000000-0000-4000-8000-000000006928","name":"Coordinator workflow","nodes":[],"edges":[],"nodeCount":0,"edgeCount":0,"omitted":"Node parameters and input/output values are excluded from this discussion snapshot"},"graphTruncated":false}}]}}}
